================================THE SERVER===================================
dragoula@dragoula-cave:~/Documents/projects/networkingProject-sockets-interface/server$ cd ~/Documents/projects/networkingProject-sockets-interface/server
./server_udp
Serveur UDP en attente sur le port 8080...
Client 127.0.0.1:39774 dit : Bonjour

================================THE CLIENT===================================
dragoula@dragoula-cave:~/Documents/projects/networkingProject-sockets-interface/Client$ cd ~/Documents/projects/networkingProject-sockets-interface/Client
./client_udp
=== Client UDP ===

[OK] Socket UDP créée

[Envoyé] Bonjour (UDP)

--- Messages du serveur ---
Il est 21:36:18 !
Il est 21:36:19 !
Il est 21:36:20 !
Il est 21:36:21 !
Il est 21:36:22 !
Il est 21:36:23 !
Il est 21:36:24 !
Il est 21:36:25 !
Il est 21:36:26 !
Il est 21:36:27 !
Il est 21:36:28 !
Il est 21:36:29 !
Il est 21:36:30 !
Il est 21:36:31 !
Il est 21:36:32 !
Il est 21:36:33 !
Il est 21:36:34 !
Il est 21:36:35 !
Il est 21:36:36 !
Il est 21:36:37 !
Il est 21:36:38 !
Il est 21:36:39 !
Il est 21:36:40 !
Il est 21:36:41 !
Il est 21:36:42 !
Il est 21:36:43 !
Il est 21:36:44 !
Il est 21:36:45 !
Il est 21:36:46 !
Il est 21:36:47 !
Il est 21:36:48 !
Il est 21:36:49 !
Il est 21:36:50 !
Il est 21:36:51 !
Il est 21:36:52 !
Il est 21:36:53 !
Il est 21:36:54 !
Il est 21:36:55 !
Il est 21:36:56 !
Il est 21:36:57 !
Il est 21:36:58 !
Il est 21:36:59 !
Il est 21:37:00 !
Il est 21:37:01 !
Il est 21:37:02 !
Il est 21:37:03 !
Il est 21:37:04 !
Il est 21:37:05 !
Il est 21:37:06 !
Il est 21:37:07 !
Il est 21:37:08 !
Il est 21:37:09 !
Il est 21:37:10 !
Il est 21:37:11 !
Il est 21:37:12 !
Il est 21:37:13 !
Il est 21:37:14 !
Il est 21:37:15 !
Il est 21:37:16 !
Il est 21:37:17 !
Au revoir

--- Fin de l'échange ---
Datagrammes reçus : 61 (en UDP, 1 recvfrom = 1 message)

================================THE TCPDUMP===================================
dragoula@dragoula-cave:~$ sudo tcpdump -i lo -A udp port 8080
tcpdump: verbose output suppressed, use -v[v]... for full protocol decode
listening on lo, link-type EN10MB (Ethernet), snapshot length 262144 bytes
21:36:18.275338 IP localhost.39774 > localhost.8080: UDP, length 8
E..$#.@.@............^.....#Bonjour

21:36:18.275531 IP localhost.8080 > localhost.39774: UDP, length 18
E...#.@.@..............^...-Il est 21:36:18 !

21:36:19.275711 IP localhost.8080 > localhost.39774: UDP, length 18
E...%p@.@..M...........^...-Il est 21:36:19 !

21:36:20.275882 IP localhost.8080 > localhost.39774: UDP, length 18
E...'h@.@..U...........^...-Il est 21:36:20 !

21:36:21.276055 IP localhost.8080 > localhost.39774: UDP, length 18
E...(j@.@..S...........^...-Il est 21:36:21 !

21:36:22.276257 IP localhost.8080 > localhost.39774: UDP, length 18
E...*#@.@..............^...-Il est 21:36:22 !

21:36:23.276455 IP localhost.8080 > localhost.39774: UDP, length 18
E...,.@.@..............^...-Il est 21:36:23 !

21:36:24.276664 IP localhost.8080 > localhost.39774: UDP, length 18
E...0.@.@..............^...-Il est 21:36:24 !

21:36:25.276813 IP localhost.8080 > localhost.39774: UDP, length 18
E...1	@.@..............^...-Il est 21:36:25 !

21:36:26.276962 IP localhost.8080 > localhost.39774: UDP, length 18
E...3.@.@..............^...-Il est 21:36:26 !

21:36:27.277127 IP localhost.8080 > localhost.39774: UDP, length 18
E...4G@.@..v...........^...-Il est 21:36:27 !

21:36:28.277366 IP localhost.8080 > localhost.39774: UDP, length 18
E...78@.@..............^...-Il est 21:36:28 !

21:36:29.277689 IP localhost.8080 > localhost.39774: UDP, length 18
E...7.@.@.. ...........^...-Il est 21:36:29 !

21:36:30.277947 IP localhost.8080 > localhost.39774: UDP, length 18
E...;7@.@..............^...-Il est 21:36:30 !

21:36:31.278128 IP localhost.8080 > localhost.39774: UDP, length 18
E...>l@.@..P...........^...-Il est 21:36:31 !

21:36:32.278351 IP localhost.8080 > localhost.39774: UDP, length 18
E...?	@.@..............^...-Il est 21:36:32 !

21:36:33.278624 IP localhost.8080 > localhost.39774: UDP, length 18
E...Bp@.@..L...........^...-Il est 21:36:33 !

21:36:34.278833 IP localhost.8080 > localhost.39774: UDP, length 18
E...E.@.@..............^...-Il est 21:36:34 !

21:36:35.279028 IP localhost.8080 > localhost.39774: UDP, length 18
E...E.@.@..............^...-Il est 21:36:35 !

21:36:36.279248 IP localhost.8080 > localhost.39774: UDP, length 18
E...H.@.@..............^...-Il est 21:36:36 !

21:36:37.279546 IP localhost.8080 > localhost.39774: UDP, length 18
E...J-@.@..............^...-Il est 21:36:37 !

21:36:38.279756 IP localhost.8080 > localhost.39774: UDP, length 18
E...M.@.@..............^...-Il est 21:36:38 !

21:36:39.280002 IP localhost.8080 > localhost.39774: UDP, length 18
E...Ow@.@..E...........^...-Il est 21:36:39 !

21:36:40.280289 IP localhost.8080 > localhost.39774: UDP, length 18
E...S;@.@..............^...-Il est 21:36:40 !

21:36:41.280537 IP localhost.8080 > localhost.39774: UDP, length 18
E...T.@.@..............^...-Il est 21:36:41 !

21:36:42.280748 IP localhost.8080 > localhost.39774: UDP, length 18
E...Wd@.@..X...........^...-Il est 21:36:42 !

21:36:43.280937 IP localhost.8080 > localhost.39774: UDP, length 18
E...Ys@.@..I...........^...-Il est 21:36:43 !

21:36:44.281137 IP localhost.8080 > localhost.39774: UDP, length 18
E...]R@.@..j...........^...-Il est 21:36:44 !

21:36:45.281358 IP localhost.8080 > localhost.39774: UDP, length 18
E...`-@.@..............^...-Il est 21:36:45 !

21:36:46.281550 IP localhost.8080 > localhost.39774: UDP, length 18
E...`.@.@..............^...-Il est 21:36:46 !

21:36:47.281732 IP localhost.8080 > localhost.39774: UDP, length 18
E...aB@.@..z...........^...-Il est 21:36:47 !

21:36:48.281895 IP localhost.8080 > localhost.39774: UDP, length 18
E...d.@.@..............^...-Il est 21:36:48 !

21:36:49.282054 IP localhost.8080 > localhost.39774: UDP, length 18
E...gz@.@..B...........^...-Il est 21:36:49 !

21:36:50.282234 IP localhost.8080 > localhost.39774: UDP, length 18
E...g~@.@..>...........^...-Il est 21:36:50 !

21:36:51.282404 IP localhost.8080 > localhost.39774: UDP, length 18
E...i.@.@..#...........^...-Il est 21:36:51 !

21:36:52.282523 IP localhost.8080 > localhost.39774: UDP, length 18
E...m.@.@..<...........^...-Il est 21:36:52 !

21:36:53.282689 IP localhost.8080 > localhost.39774: UDP, length 18
E...m.@.@..............^...-Il est 21:36:53 !

21:36:54.282913 IP localhost.8080 > localhost.39774: UDP, length 18
E...p1@.@..............^...-Il est 21:36:54 !

21:36:55.283098 IP localhost.8080 > localhost.39774: UDP, length 18
E...q.@.@..............^...-Il est 21:36:55 !

21:36:56.283360 IP localhost.8080 > localhost.39774: UDP, length 18
E...u.@.@..............^...-Il est 21:36:56 !

21:36:57.283550 IP localhost.8080 > localhost.39774: UDP, length 18
E...x.@.@..............^...-Il est 21:36:57 !

21:36:58.283663 IP localhost.8080 > localhost.39774: UDP, length 18
E...z=@.@..............^...-Il est 21:36:58 !

21:36:59.283826 IP localhost.8080 > localhost.39774: UDP, length 18
E...{.@.@..............^...-Il est 21:36:59 !

21:37:00.283970 IP localhost.8080 > localhost.39774: UDP, length 18
E...|j@.@..R...........^...-Il est 21:37:00 !

21:37:01.284123 IP localhost.8080 > localhost.39774: UDP, length 18
E.....@.@..%...........^...-Il est 21:37:01 !

21:37:02.284314 IP localhost.8080 > localhost.39774: UDP, length 18
E....-@.@..............^...-Il est 21:37:02 !

21:37:03.284567 IP localhost.8080 > localhost.39774: UDP, length 18
E....0@.@..............^...-Il est 21:37:03 !

21:37:04.284789 IP localhost.8080 > localhost.39774: UDP, length 18
E.....@.@..............^...-Il est 21:37:04 !

21:37:05.285094 IP localhost.8080 > localhost.39774: UDP, length 18
E....,@.@..............^...-Il est 21:37:05 !

21:37:06.285291 IP localhost.8080 > localhost.39774: UDP, length 18
E.....@.@..:...........^...-Il est 21:37:06 !

21:37:07.285569 IP localhost.8080 > localhost.39774: UDP, length 18
E.....@.@..............^...-Il est 21:37:07 !

21:37:08.285780 IP localhost.8080 > localhost.39774: UDP, length 18
E....?@.@..}...........^...-Il est 21:37:08 !

21:37:09.286008 IP localhost.8080 > localhost.39774: UDP, length 18
E....&@.@..............^...-Il est 21:37:09 !

21:37:10.286180 IP localhost.8080 > localhost.39774: UDP, length 18
E....V@.@..f...........^...-Il est 21:37:10 !

21:37:11.286405 IP localhost.8080 > localhost.39774: UDP, length 18
E....M@.@..o...........^...-Il est 21:37:11 !

21:37:12.286680 IP localhost.8080 > localhost.39774: UDP, length 18
E.....@.@..1...........^...-Il est 21:37:12 !

21:37:13.286899 IP localhost.8080 > localhost.39774: UDP, length 18
E....e@.@..W...........^...-Il est 21:37:13 !

21:37:14.287141 IP localhost.8080 > localhost.39774: UDP, length 18
E.....@.@..!...........^...-Il est 21:37:14 !

21:37:15.287545 IP localhost.8080 > localhost.39774: UDP, length 18
E....n@.@..N...........^...-Il est 21:37:15 !

21:37:16.287743 IP localhost.8080 > localhost.39774: UDP, length 18
E.....@.@..............^...-Il est 21:37:16 !

21:37:17.287917 IP localhost.8080 > localhost.39774: UDP, length 18
E....L@.@..p...........^...-Il est 21:37:17 !

21:37:18.288063 IP localhost.8080 > localhost.39774: UDP, length 10
E..&..@.@..............^...%Au revoir

^C
62 packets captured
124 packets received by filter
0 packets dropped by kernel
